{
  "generated_at": "2026-05-06T08:51:21.679Z",
  "run_finished_at": "2026-05-06T08:51:10.855Z",
  "input_dir": "D:\\Users\\HCI_lab\\Desktop\\github\\飞书比赛\\data\\outputs\\demo\\case05\\auto",
  "title": "Case Full OB 20260506",
  "output_markdown": "D:\\Users\\HCI_lab\\Desktop\\github\\飞书比赛\\docs\\observability\\case_full_ob_20260506_085200.md",
  "markdown_sha256": "8de9d642eaa9901cb9443ae3385c5b208a0ff0cccb91d78495268a48e4c90c6b",
  "run_summary": {
    "project_id": "PJT-CASE-05",
    "manager_id": "MGR-CASE-05",
    "meeting_id": "MTG-CASE-05-03",
    "evaluation_period": "2026-01-01 ~ 2026-04-24",
    "orchestration_status": "collected",
    "completeness_status": "ready",
    "assessment_status": "degraded",
    "report_status": "degraded"
  },
  "missing_artifacts": [],
  "observability_issues": [],
  "section_counts": {
    "runtime_row_count": 9,
    "source_coverage_count": 7,
    "hard_metric_count": 15,
    "expert_finding_count": 10,
    "risk_flag_count": 3,
    "capability_score_count": 5,
    "report_item_count": 16
  },
  "files": {
    "task_request": "D:\\Users\\HCI_lab\\Desktop\\github\\飞书比赛\\data\\outputs\\demo\\case05\\auto\\task_request.json",
    "orchestration_state": "D:\\Users\\HCI_lab\\Desktop\\github\\飞书比赛\\data\\outputs\\demo\\case05\\auto\\orchestration_state.json",
    "input_completeness_report": "D:\\Users\\HCI_lab\\Desktop\\github\\飞书比赛\\data\\outputs\\demo\\case05\\auto\\input_completeness_report.json",
    "raw_payload": "D:\\Users\\HCI_lab\\Desktop\\github\\飞书比赛\\data\\outputs\\demo\\case05\\auto\\raw_payload.json",
    "history_bundle": "D:\\Users\\HCI_lab\\Desktop\\github\\飞书比赛\\data\\outputs\\demo\\case05\\auto\\history_bundle.json",
    "meeting_fact_pack": "D:\\Users\\HCI_lab\\Desktop\\github\\飞书比赛\\data\\outputs\\demo\\case05\\auto\\meeting_fact_pack.json",
    "data_quality_report": "D:\\Users\\HCI_lab\\Desktop\\github\\飞书比赛\\data\\outputs\\demo\\case05\\auto\\data_quality_report.json",
    "hard_metrics_result": "D:\\Users\\HCI_lab\\Desktop\\github\\飞书比赛\\data\\outputs\\demo\\case05\\auto\\hard_metrics_result.json",
    "evaluation_plan": "D:\\Users\\HCI_lab\\Desktop\\github\\飞书比赛\\data\\outputs\\demo\\case05\\auto\\evaluation_plan.json",
    "management_reviewer_request": "D:\\Users\\HCI_lab\\Desktop\\github\\飞书比赛\\data\\outputs\\demo\\case05\\auto\\management_reviewer_request.json",
    "management_reviewer_result": "D:\\Users\\HCI_lab\\Desktop\\github\\飞书比赛\\data\\outputs\\demo\\case05\\auto\\management_reviewer_result.json",
    "risk_behavior_auditor_request": "D:\\Users\\HCI_lab\\Desktop\\github\\飞书比赛\\data\\outputs\\demo\\case05\\auto\\risk_behavior_auditor_request.json",
    "risk_behavior_auditor_result": "D:\\Users\\HCI_lab\\Desktop\\github\\飞书比赛\\data\\outputs\\demo\\case05\\auto\\risk_behavior_auditor_result.json",
    "coordination_lens_request": "D:\\Users\\HCI_lab\\Desktop\\github\\飞书比赛\\data\\outputs\\demo\\case05\\auto\\coordination_lens_request.json",
    "coordination_lens_result": "D:\\Users\\HCI_lab\\Desktop\\github\\飞书比赛\\data\\outputs\\demo\\case05\\auto\\coordination_lens_result.json",
    "capability_assessor_request": "D:\\Users\\HCI_lab\\Desktop\\github\\飞书比赛\\data\\outputs\\demo\\case05\\auto\\capability_assessor_request.json",
    "capability_assessor_result": "D:\\Users\\HCI_lab\\Desktop\\github\\飞书比赛\\data\\outputs\\demo\\case05\\auto\\capability_assessor_result.json",
    "report_writer_request": "D:\\Users\\HCI_lab\\Desktop\\github\\飞书比赛\\data\\outputs\\demo\\case05\\auto\\report_writer_request.json",
    "report_result": "D:\\Users\\HCI_lab\\Desktop\\github\\飞书比赛\\data\\outputs\\demo\\case05\\auto\\report_result.json",
    "automation_summary": "D:\\Users\\HCI_lab\\Desktop\\github\\飞书比赛\\data\\outputs\\demo\\case05\\auto\\automation_summary.json",
    "observability_summary": "D:\\Users\\HCI_lab\\Desktop\\github\\飞书比赛\\data\\outputs\\demo\\case05\\auto\\observability_summary.json",
    "full_loop_observability": "D:\\Users\\HCI_lab\\Desktop\\github\\飞书比赛\\data\\outputs\\demo\\case05\\auto\\full_loop_observability.json",
    "observability_markdown": "D:\\Users\\HCI_lab\\Desktop\\github\\飞书比赛\\data\\outputs\\demo\\case05\\auto\\observability.md",
    "full_loop_observability_markdown": "D:\\Users\\HCI_lab\\Desktop\\github\\飞书比赛\\data\\outputs\\demo\\case05\\auto\\full_loop_observability.md"
  }
}